{
  "schema_version": "0.1.0",
  "boundary_statement": "This is a benchmark record for comparative speed. It is not a conformance record, not a certificate, and not a performance-class rating; a bench result may motivate a class run, never substitute for one.",
  "methodology": "Seed once, measure N times. Measured phases are open-loop: arrivals fire at their planned instants regardless of any other request's completion, and every latency is measured from the planned arrival instant, so coordinated omission cannot hide a stall. Seed phases are closed-loop by construction and are reported as bulk-load throughput only.",
  "relative_index": "The relative index is the target's cross-repetition median divided by the baseline's cross-repetition median for the same phase, operation and metric, both measured on the same host in the same session. It is dimensionless. On a latency metric a value below 1.0 means the target answered faster than the baseline and above 1.0 slower; on throughput the sense inverts, because there a larger number is the faster system.",
  "seed_disclosure": "Every pack declares one seed, and every draw a run makes derives from it: which operation each arrival offers, which EHR or composition it addresses, and the query parameters a measured AQL class substitutes. Two runs of the same pack version at the same scale therefore offer the same work in the same order, on any machine and against any system, which is what makes two records comparable at all. The seed is a property of the pack rather than of the run, so it is not an operator input and no command-line flag moves it.",
  "posture_disclosure": "Two speed numbers are comparable only when the same features were switched on behind them, so every pack defines named posture profiles and a run declares exactly one with --posture. The record then carries one line per disclosed item, and each line is labelled verified or declared-only: a black-box canary reads the item off the running system before and after the measured window, and where released ITS-REST surfaces nothing to read the declaration is carried as a claim and says so. A canary that contradicts the declaration, and a pair of brackets that disagree with each other, both refuse the whole run. Authentication and TLS are facts of the invocation rather than choices of the profile, so a profile leaves them to the run.",
  "submission_requirements": [
    {
      "token": "repetitions",
      "statement": "at least 3 repetitions, because one repetition measures a moment rather than a system"
    },
    {
      "token": "baseline",
      "statement": "at least one same-machine baseline, because an absolute number without an anchor describes the machine as much as the system"
    }
  ],
  "operations": [
    {
      "token": "adhoc_query_aggregate",
      "wire": "POST /query/aql"
    },
    {
      "token": "adhoc_query_ehr_scan",
      "wire": "POST /query/aql"
    },
    {
      "token": "adhoc_query_filtered",
      "wire": "POST /query/aql"
    },
    {
      "token": "adhoc_query_ordered_page",
      "wire": "POST /query/aql"
    },
    {
      "token": "adhoc_query_point_lookup",
      "wire": "POST /query/aql"
    },
    {
      "token": "adhoc_query_population",
      "wire": "POST /query/aql"
    },
    {
      "token": "adhoc_query_uid",
      "wire": "POST /query/aql"
    },
    {
      "token": "create_composition",
      "wire": "POST /ehr/{ehr_id}/composition"
    },
    {
      "token": "get_composition_at_time",
      "wire": "GET /ehr/{ehr_id}/composition/{uid}?version_at_time={at_time}"
    },
    {
      "token": "get_composition_latest",
      "wire": "GET /ehr/{ehr_id}/composition/{uid}"
    },
    {
      "token": "get_ehr",
      "wire": "GET /ehr/{ehr_id}"
    },
    {
      "token": "get_ehr_status",
      "wire": "GET /ehr/{ehr_id}/ehr_status"
    },
    {
      "token": "get_versioned_composition",
      "wire": "GET /ehr/{ehr_id}/versioned_composition/{uid}"
    },
    {
      "token": "get_versioned_composition_revision_history",
      "wire": "GET /ehr/{ehr_id}/versioned_composition/{uid}/revision_history"
    },
    {
      "token": "get_versioned_composition_version_at_time",
      "wire": "GET /ehr/{ehr_id}/versioned_composition/{uid}/version?version_at_time={at_time}"
    },
    {
      "token": "get_versioned_composition_version_by_id",
      "wire": "GET /ehr/{ehr_id}/versioned_composition/{uid}/version/{version_uid}"
    },
    {
      "token": "get_versioned_composition_version_latest",
      "wire": "GET /ehr/{ehr_id}/versioned_composition/{uid}/version"
    }
  ],
  "packs": [
    {
      "id": "aql-mix",
      "version": "1.0.0",
      "description": "Measures AQL query speed over the same Vital signs population the community-vitals pack seeds, so a query figure and a read figure describe the same corpus. The seed phase creates 50 EHRs and commits the same composition 20 times into each, on a pool of 8 workers. This pack version pins that population, and it is sized for query shapes: large enough that a query has to choose an access path, small enough to load before a measured window opens. The measured phase is open-loop at 24 arrivals a second for 60s after a 15s warmup, over six query classes at equal share, so each class is offered at 4 arrivals a second and every class returns the same number of samples. Each class posts one AQL statement to /query/aql, accepts only 200, and counts every other answer in its own error class, so a server that refuses one shape never contaminates another class's percentiles. Every query parameter draws from the run's seeded streams: the systolic threshold, the page offset, and the EHR or composition each arrival addresses, so no arrival repeats the previous one's result set and the whole draw is reproducible from the seed the record discloses. The six classes: adhoc_query_point_lookup probes the indexed-read floor: one composition addressed by its own uid inside one EHR, the cheapest query a server can answer; adhoc_query_ehr_scan probes the loaded-database shape: every composition in one EHR projected by uid, so the cost follows how much that EHR holds; adhoc_query_filtered probes the value index: a systolic magnitude threshold over the observation leaves of one EHR, with the threshold drawn per arrival so no result set can be memoized; adhoc_query_population probes the cross-EHR planner: the same magnitude threshold with no EHR scope and a fetch bound, so the server picks an access path over the whole population; adhoc_query_aggregate probes the columnar shape: one COUNT over the population that threshold matches, which returns a single row and reads every value behind it; adhoc_query_ordered_page probes sorting and pagination: an ORDER BY over composition start time read through a moving fetch window, the shape a paged user interface issues. Fixture provenance: the operational template is the vendored CKM export for template id 'Vital signs' (CKM cid 1013.26.380) and the composition is the attachment on post 8 of <https://discourse.openehr.org/t/17224>, both byte-identical and pinned by sha256.",
      "seed": 4706627057783240704,
      "fixtures": [
        {
          "key": "vital_signs.opt",
          "kind": "operational_template",
          "media_type": "application/xml",
          "bytes": 223110,
          "sha256": "3a0d31bd3b5dc6329e53c0d6f22fdbaece62c684136b86139d0729cff8796128",
          "provenance": "The openEHR Clinical Knowledge Manager's own Operational Template export for template id 'Vital signs' (CKM cid 1013.26.380, <https://ckm.openehr.org/ckm>), vendored byte-identically and rooted at openEHR-EHR-COMPOSITION.encounter.v1."
        },
        {
          "key": "vital_signs_composition.json",
          "kind": "composition",
          "media_type": "application/json",
          "bytes": 22637,
          "sha256": "468081c259c737d35d7f80403562b3f333e479d267286faf80fd7c087eaba947",
          "provenance": "The composition attached to post 8 of the openEHR community's vital-signs benchmark thread (<https://discourse.openehr.org/t/17224>), vendored byte-identically: eight OBSERVATION entries under openEHR-EHR-COMPOSITION.encounter.v1, rm_version 1.0.2, declaring template id 'Vital signs'."
        },
        {
          "key": "vital_signs_composition.missing_composer.json",
          "kind": "invalid_composition",
          "media_type": "application/json",
          "bytes": 22356,
          "sha256": "f0598db5ab447b371ead28cba0f841f72370dbbf93db98d5b8e477910a42688d",
          "provenance": "Derived in this repository from vital_signs_composition.json by deleting the mandatory COMPOSITION.composer member and nothing else, so a server that validates a commit against the reference model refuses it."
        }
      ],
      "phases": [
        {
          "kind": "seed",
          "name": "seed",
          "discipline": "closed-loop",
          "ehrs": 50,
          "compositions_per_ehr": 20,
          "compositions": 1000,
          "workers": 8,
          "fixtures": [
            "vital_signs.opt",
            "vital_signs_composition.json",
            "vital_signs_composition.missing_composer.json"
          ]
        },
        {
          "kind": "measure",
          "name": "queries",
          "discipline": "open-loop",
          "rate_per_s": 24.0,
          "warmup_s": 15,
          "duration_s": 60,
          "planned_arrivals": 1800,
          "planned_measured_arrivals": 1440,
          "mix": [
            {
              "op": "adhoc_query_point_lookup",
              "share": 1,
              "rate_per_s": 4.0,
              "rationale": "the indexed-read floor: one composition addressed by its own uid inside one EHR, the cheapest query a server can answer"
            },
            {
              "op": "adhoc_query_ehr_scan",
              "share": 1,
              "rate_per_s": 4.0,